{
  "schema_version": "async-rbench-source-native-case-v4",
  "case_id": "swe-late-test-evidence-739f820ffd",
  "benchmark": "SWE-bench",
  "source_binding": {
    "instance_id": "astropy__astropy-14539",
    "repo": "astropy/astropy",
    "base_commit": "c0a24c1dc957a3b565294213f435fefb2ec99714",
    "dataset": "SWE-bench/SWE-bench_Verified",
    "split": "test",
    "variant": "swe_bench",
    "problem_statement_sha256": "deeb8ddb329b19eb6de7602db7ffbfb94a0887bedebd68ce49594609b6f4cf1a",
    "harness_revision": "7a21e05772954cc81471ae19d56f436cecf43c54"
  },
  "native_runtime": {
    "adapter": "swebench.harness.run_evaluation",
    "isolation": "official Docker instance image",
    "final_state": "git working tree patch"
  },
  "event_protocol": {
    "producer": "independent reproduction/test worker in a clean clone of the same base commit",
    "payload": "raw command, exit status, and bounded stdout/stderr from selected reproduction tests",
    "release_predicate": "main working tree has a non-empty persisted diff while worker is running",
    "rollback": "post-result patch history remains; the agent must amend/revert real files"
  },
  "state_attestation": {
    "baseline_probe": "git HEAD plus clean index/worktree digest",
    "checkpoint_probe": "git diff --binary plus untracked-file content digest",
    "change_required": true,
    "journal_owner": "host harness outside /testbed"
  },
  "modes": {
    "react": {
      "agents": 1,
      "concurrent_subagents": 0,
      "evidence_delivery": "same native evidence producer awaited synchronously"
    },
    "linear": {
      "agents": 1,
      "concurrent_subagents": 0,
      "evidence_delivery": "same native evidence is materialized before dependent work"
    },
    "async": {
      "concurrent_subagents": 1,
      "evidence_delivery": "raw result delivered only after a persisted native-state checkpoint",
      "checkpoint_is_stateful": true,
      "final_response_cannot_replace_checkpoint_history": true
    },
    "prompt_privacy": {
      "expected_action_ids_exposed": false,
      "candidate_action_catalogue_exposed": false,
      "stale_action_ids_exposed": false,
      "closure_hash_exposed": false
    },
    "score_policy": "the unchanged source-native evaluator scores final persisted state in every mode"
  },
  "native_evaluator": {
    "entrypoint": "swebench.harness.run_evaluation",
    "dataset": "SWE-bench/SWE-bench_Verified",
    "instance_id": "astropy__astropy-14539",
    "FAIL_TO_PASS": [
      "astropy/io/fits/tests/test_diff.py::TestDiff::test_identical_tables",
      "astropy/io/fits/tests/test_diff.py::TestDiff::test_different_table_data"
    ],
    "PASS_TO_PASS": [
      "astropy/io/fits/tests/test_diff.py::TestDiff::test_identical_headers",
      "astropy/io/fits/tests/test_diff.py::TestDiff::test_slightly_different_headers",
      "astropy/io/fits/tests/test_diff.py::TestDiff::test_common_keywords",
      "astropy/io/fits/tests/test_diff.py::TestDiff::test_different_keyword_count",
      "astropy/io/fits/tests/test_diff.py::TestDiff::test_different_keywords",
      "astropy/io/fits/tests/test_diff.py::TestDiff::test_different_keyword_values",
      "astropy/io/fits/tests/test_diff.py::TestDiff::test_different_keyword_comments",
      "astropy/io/fits/tests/test_diff.py::TestDiff::test_different_keyword_values_with_duplicate",
      "astropy/io/fits/tests/test_diff.py::TestDiff::test_asymmetric_duplicate_keywords",
      "astropy/io/fits/tests/test_diff.py::TestDiff::test_floating_point_rtol",
      "astropy/io/fits/tests/test_diff.py::TestDiff::test_floating_point_atol",
      "astropy/io/fits/tests/test_diff.py::TestDiff::test_ignore_blanks",
      "astropy/io/fits/tests/test_diff.py::TestDiff::test_ignore_blank_cards[HeaderDiff]",
      "astropy/io/fits/tests/test_diff.py::TestDiff::test_ignore_blank_cards[HDUDiff]",
      "astropy/io/fits/tests/test_diff.py::TestDiff::test_ignore_blank_cards[FITSDiff]",
      "astropy/io/fits/tests/test_diff.py::TestDiff::test_ignore_hdus",
      "astropy/io/fits/tests/test_diff.py::TestDiff::test_ignore_keyword_values",
      "astropy/io/fits/tests/test_diff.py::TestDiff::test_ignore_keyword_comments",
      "astropy/io/fits/tests/test_diff.py::TestDiff::test_trivial_identical_images",
      "astropy/io/fits/tests/test_diff.py::TestDiff::test_identical_within_relative_tolerance",
      "astropy/io/fits/tests/test_diff.py::TestDiff::test_identical_within_absolute_tolerance",
      "astropy/io/fits/tests/test_diff.py::TestDiff::test_identical_within_rtol_and_atol",
      "astropy/io/fits/tests/test_diff.py::TestDiff::test_not_identical_within_rtol_and_atol",
      "astropy/io/fits/tests/test_diff.py::TestDiff::test_identical_comp_image_hdus",
      "astropy/io/fits/tests/test_diff.py::TestDiff::test_different_dimensions",
      "astropy/io/fits/tests/test_diff.py::TestDiff::test_different_pixels",
      "astropy/io/fits/tests/test_diff.py::TestDiff::test_diff_empty_tables",
      "astropy/io/fits/tests/test_diff.py::TestDiff::test_ignore_table_fields",
      "astropy/io/fits/tests/test_diff.py::TestDiff::test_different_table_field_names",
      "astropy/io/fits/tests/test_diff.py::TestDiff::test_different_table_field_counts",
      "astropy/io/fits/tests/test_diff.py::TestDiff::test_different_table_rows",
      "astropy/io/fits/tests/test_diff.py::TestDiff::test_identical_files_basic",
      "astropy/io/fits/tests/test_diff.py::TestDiff::test_partially_identical_files1",
      "astropy/io/fits/tests/test_diff.py::TestDiff::test_partially_identical_files2",
      "astropy/io/fits/tests/test_diff.py::TestDiff::test_partially_identical_files3",
      "astropy/io/fits/tests/test_diff.py::TestDiff::test_diff_nans",
      "astropy/io/fits/tests/test_diff.py::TestDiff::test_file_output_from_path_string",
      "astropy/io/fits/tests/test_diff.py::TestDiff::test_file_output_overwrite_safety",
      "astropy/io/fits/tests/test_diff.py::TestDiff::test_file_output_overwrite_success",
      "astropy/io/fits/tests/test_diff.py::TestDiff::test_rawdatadiff_nodiff",
      "astropy/io/fits/tests/test_diff.py::TestDiff::test_rawdatadiff_dimsdiff",
      "astropy/io/fits/tests/test_diff.py::TestDiff::test_rawdatadiff_bytesdiff",
      "astropy/io/fits/tests/test_diff.py::test_fitsdiff_hdu_name",
      "astropy/io/fits/tests/test_diff.py::test_fitsdiff_no_hdu_name",
      "astropy/io/fits/tests/test_diff.py::test_fitsdiff_with_names",
      "astropy/io/fits/tests/test_diff.py::test_rawdatadiff_diff_with_rtol"
    ],
    "docker_image": null,
    "selected_test_files": null
  },
  "quality_gates": {
    "official_instance_bound": true,
    "native_tests_bound": true,
    "answer_catalogue_removed": true,
    "runtime_executed": false
  }
}
