{
  "schema_version": "async-rbench-source-native-case-v4",
  "case_id": "mab-dependency-unblock-19d693bd13",
  "benchmark": "MultiAgentBench",
  "source_binding": {
    "task_id": "coding:018",
    "scenario": "coding",
    "jsonl_path": "upstream/marble/multiagentbench/coding/coding_main.jsonl",
    "line_number": 18,
    "record_sha256": "01256d141e85bb4409e3a85a1f46838dfff36451b1660703da047800f8defdc9",
    "upstream_revision": "8d60fa17b5596b44458a52d4296061b9fc13d6f2"
  },
  "native_runtime": {
    "adapter": "marble.engine.Engine",
    "environment": {
      "type": "",
      "name": "",
      "workspace_dir": "workspace",
      "max_iterations": ""
    },
    "roles": [
      {
        "type": "CodingAgent",
        "agent_id": "agent1",
        "profile": "I am a Senior Software Developer specialized in Python development.\nI am good at creating the code framework from scratch based on the task description and requirements.\nSo I **have to** call \"create_code\" action to create the code in the first iteration at first.\nI am **very terrible** at do further modifications since I am not so creative or careful so I **have to** let agent 2 or agent 3 revise the code after I create the code and I **can't** call \"give_advice_and_revise_code\" action.\nAgent 2 is better at adding missing functions so it's better to let agent 2 revise the code at first.\nAgent 3 is better at fixing existing issues and optimizing the code so it's better to let agent 3 revise the code after agent 2 has revised the code so that the code is more optimized.\n"
      },
      {
        "type": "CodingAgent",
        "agent_id": "agent2",
        "profile": "I am a Senior Software Developer specialized in Python development.\nI am better at adding missing functionality based on my decent understanding and compliance to the task description and requirements.\nI **have to** call \"give_advice_and_revise_code\" action to give advice to the code and revise the code.\nI **can't** call \"create_code\" action since I am not good at creating the code framework from scratch.\nI can let agent 3 to make the code more optimized after I have added the missing functionality.\n"
      },
      {
        "type": "CodingAgent",
        "agent_id": "agent3",
        "profile": "I am a Senior Software Developer specialized in Python development.\nI am better at fixing existing issues and optimizing the code based on my innovation and creativity.\nI **have to** call \"give_advice_and_revise_code\" action to give advice to the code and revise the code.\nI **can't** call \"create_code\" action since I am not good at creating the code framework from scratch.\nI can let agent 2 to add the missing functionality after I have fixed the existing issues and optimized the code.\n"
      }
    ],
    "final_state": "MARBLE environment and tool transcript"
  },
  "event_protocol": {
    "producer": "an actual MARBLE role executes with its declared profile and tools",
    "payload": "the role's native message/tool result with provenance and logical clock",
    "release_predicate": "coordinator committed at least one environment action after launching the role",
    "rollback": "messages and tool calls remain in the native transcript; correction is additive and auditable"
  },
  "state_attestation": {
    "baseline_probe": "serialized MARBLE environment state and transcript sequence zero",
    "checkpoint_probe": "environment digest plus strictly increased native tool/action sequence",
    "change_required": true,
    "journal_owner": "MARBLE engine logger, not an agent workspace file"
  },
  "modes": {
    "react": {
      "agents": 1,
      "concurrent_subagents": 0,
      "evidence_delivery": "same native evidence producer awaited synchronously"
    },
    "linear": {
      "agents": 1,
      "concurrent_subagents": 0,
      "evidence_delivery": "same native evidence is materialized before dependent work"
    },
    "async": {
      "concurrent_subagents": 1,
      "evidence_delivery": "raw result delivered only after a persisted native-state checkpoint",
      "checkpoint_is_stateful": true,
      "final_response_cannot_replace_checkpoint_history": true
    },
    "prompt_privacy": {
      "expected_action_ids_exposed": false,
      "candidate_action_catalogue_exposed": false,
      "stale_action_ids_exposed": false,
      "closure_hash_exposed": false
    },
    "score_policy": "the unchanged source-native evaluator scores final persisted state in every mode"
  },
  "native_evaluator": {
    "metrics": {
      "evaluate_llm": "",
      "code_quality": true,
      "test_coverage": true,
      "collaboration_effectiveness": true
    },
    "agreement_or_environment_state": true
  },
  "quality_gates": {
    "official_scenario_bound": true,
    "native_roles_bound": true,
    "answer_catalogue_removed": true,
    "runtime_executed": false
  }
}
